{
  "$schema": "https://json-schema.org/draft/2020-12/schema",
  "$id": "https://skenion.dev/schemas/node/v0.1/node-definition.schema.json",
  "title": "skenion Node Definition Manifest v0.1",
  "type": "object",
  "required": [
    "schema",
    "schemaVersion",
    "id",
    "version",
    "displayName",
    "category",
    "ports",
    "execution",
    "state",
    "permissions",
    "capabilities"
  ],
  "properties": {
    "schema": {
      "const": "skenion.node.definition"
    },
    "schemaVersion": {
      "const": "0.1.0"
    },
    "id": {
      "type": "string",
      "minLength": 1
    },
    "version": {
      "type": "string",
      "minLength": 1
    },
    "displayName": {
      "type": "string",
      "minLength": 1
    },
    "category": {
      "type": "string",
      "minLength": 1
    },
    "scriptApiVersion": {
      "type": "string",
      "minLength": 1
    },
    "bundleHash": {
      "type": "string",
      "minLength": 1
    },
    "surface": {
      "$ref": "#/$defs/surface"
    },
    "ports": {
      "type": "array",
      "items": {
        "$ref": "#/$defs/port"
      }
    },
    "portGroups": {
      "type": "array",
      "items": {
        "$ref": "#/$defs/portGroup"
      }
    },
    "execution": {
      "$ref": "#/$defs/execution"
    },
    "state": {
      "$ref": "#/$defs/state"
    },
    "permissions": {
      "type": "array",
      "items": {
        "type": "string"
      }
    },
    "capabilities": {
      "type": "array",
      "items": {
        "type": "string"
      }
    }
  },
  "additionalProperties": false,
  "$defs": {
    "port": {
      "type": "object",
      "required": ["id", "direction", "type"],
      "properties": {
        "id": {
          "type": "string",
          "minLength": 1
        },
        "direction": {
          "enum": ["input", "output"]
        },
        "type": {
          "type": "string",
          "minLength": 1
        },
        "label": {
          "type": "string"
        },
        "rate": {
          "enum": ["event", "control", "audio", "render", "gpu", "resource", "io"]
        },
        "accepts": {
          "type": "array",
          "items": {
            "type": "string",
            "minLength": 1
          },
          "uniqueItems": true
        },
        "minConnections": {
          "type": "integer",
          "minimum": 0
        },
        "maxConnections": {
          "oneOf": [
            {
              "type": "integer",
              "minimum": 0
            },
            {
              "type": "null"
            }
          ]
        },
        "mergePolicy": {
          "enum": ["forbid", "ordered-events", "mix", "array", "latest", "first", "custom"]
        },
        "fanOutPolicy": {
          "enum": ["allow", "forbid", "copy", "share"]
        },
        "triggerMode": {
          "enum": ["passive", "trigger", "latched"]
        },
        "defaultValue": true,
        "latch": {
          "type": "boolean"
        },
        "required": {
          "type": "boolean"
        },
        "styleKey": {
          "type": "string",
          "minLength": 1
        },
        "group": {
          "type": "string",
          "minLength": 1
        },
        "description": {
          "type": "string"
        }
      },
      "additionalProperties": false
    },
    "portGroup": {
      "type": "object",
      "required": ["id", "direction", "type", "minPorts"],
      "properties": {
        "id": {
          "type": "string",
          "minLength": 1
        },
        "label": {
          "type": "string"
        },
        "direction": {
          "enum": ["input", "output"]
        },
        "type": {
          "type": "string",
          "minLength": 1
        },
        "rate": {
          "enum": ["event", "control", "audio", "render", "gpu", "resource", "io"]
        },
        "minPorts": {
          "type": "integer",
          "minimum": 0
        },
        "maxPorts": {
          "type": "integer",
          "minimum": 0
        },
        "ordered": {
          "type": "boolean"
        },
        "portIdPattern": {
          "type": "string",
          "minLength": 1
        },
        "createLabel": {
          "type": "string"
        },
        "defaultPortSpec": {
          "$ref": "#/$defs/port"
        }
      },
      "additionalProperties": false
    },
    "execution": {
      "type": "object",
      "required": ["model"],
      "properties": {
        "model": {
          "enum": [
            "event",
            "value",
            "frame",
            "audio_block",
            "video_frame",
            "gpu_pass",
            "async_resource",
            "script_control",
            "native_plugin"
          ]
        },
        "clock": {
          "enum": ["frame", "audio", "beat", "timecode", "external"]
        }
      },
      "additionalProperties": false
    },
    "surface": {
      "type": "object",
      "properties": {
        "palette": {
          "enum": ["direct"]
        }
      },
      "additionalProperties": false
    },
    "state": {
      "type": "object",
      "required": ["persistent"],
      "properties": {
        "persistent": {
          "type": "boolean"
        }
      },
      "additionalProperties": false
    }
  }
}
