{
  "schema": "skenion.node.definition",
  "schemaVersion": "0.1.0",
  "id": "object.core.video-decode",
  "version": "0.1.0",
  "displayName": "Video Decode",
  "category": "Converters",
  "ports": [
    {
      "id": "asset",
      "direction": "input",
      "label": "Asset",
      "type": "value.core.string",
      "required": true
    },
    {
      "id": "frames",
      "direction": "output",
      "label": "Frames",
      "type": "value.core.tensor"
    }
  ],
  "execution": {
    "model": "video_frame"
  },
  "state": {
    "persistent": false
  },
  "permissions": [],
  "capabilities": [],
  "surface": {
    "palette": "direct"
  }
}
