{
  "schema": "skenion.node.definition",
  "schemaVersion": "0.1.0",
  "id": "clock.local",
  "version": "0.1.0",
  "displayName": "Local Clock",
  "category": "Clock",
  "ports": [
    {
      "id": "sync",
      "direction": "input",
      "label": "Sync",
      "type": "clock.state",
      "required": false
    },
    {
      "id": "reset",
      "direction": "input",
      "label": "Reset",
      "type": "event.bang",
      "required": false
    },
    {
      "id": "state",
      "direction": "output",
      "label": "State",
      "type": "clock.state"
    },
    {
      "id": "tick",
      "direction": "output",
      "label": "Tick",
      "type": "event.bang"
    },
    {
      "id": "phase",
      "direction": "output",
      "label": "Phase",
      "type": "number.float"
    },
    {
      "id": "tempo",
      "direction": "output",
      "label": "Tempo",
      "type": "number.float"
    }
  ],
  "execution": {
    "model": "value",
    "clock": "beat"
  },
  "state": {
    "persistent": false
  },
  "permissions": [],
  "capabilities": [
    "clock.transport.v0.1"
  ],
  "surface": {
    "palette": "direct"
  }
}
