{
  "schema": "skenion.node.definition",
  "schemaVersion": "0.1.0",
  "id": "audio.phasor",
  "version": "0.1.0",
  "displayName": "Phasor",
  "category": "Audio",
  "ports": [
    {
      "id": "frequency",
      "direction": "input",
      "label": "Frequency",
      "type": "number.float",
      "required": false
    },
    {
      "id": "out",
      "direction": "output",
      "label": "Signal",
      "type": "signal.audio"
    }
  ],
  "execution": {
    "model": "audio_block",
    "clock": "audio"
  },
  "state": {
    "persistent": false
  },
  "permissions": [],
  "capabilities": [
    "pd.audio.v0.1"
  ],
  "surface": {
    "palette": "direct"
  }
}
