{
  "schema": "skenion.node.definition",
  "schemaVersion": "0.1.0",
  "id": "core.gpu-upload",
  "version": "0.1.0",
  "displayName": "GPU Upload",
  "category": "Converters",
  "ports": [
    {
      "id": "frames",
      "direction": "input",
      "label": "Frames",
      "type": "value.core.tensor",
      "required": true
    },
    {
      "id": "texture",
      "direction": "output",
      "label": "Texture",
      "type": "value.core.tensor"
    }
  ],
  "execution": {
    "model": "gpu_pass"
  },
  "state": {
    "persistent": false
  },
  "permissions": [],
  "capabilities": [],
  "surface": {
    "palette": "direct"
  }
}
