{
  "schema": "skenion.node.definition",
  "schemaVersion": "0.1.0",
  "id": "audio.mixer",
  "version": "0.1.0",
  "displayName": "Audio Mixer",
  "category": "Audio",
  "ports": [
    {
      "id": "out",
      "direction": "output",
      "type": "value.core.float32",
      "rate": "audio"
    }
  ],
  "portGroups": [
    {
      "id": "inputs",
      "direction": "input",
      "type": "value.core.float32",
      "rate": "audio",
      "minPorts": 1,
      "maxPorts": 64,
      "ordered": true,
      "portIdPattern": "in_{index}",
      "createLabel": "Add input",
      "defaultPortSpec": {
        "id": "in_template",
        "direction": "input",
        "type": "value.core.float32",
        "rate": "audio",
        "maxConnections": 1
      }
    }
  ],
  "execution": {
    "model": "audio_block",
    "clock": "audio"
  },
  "state": {
    "persistent": false
  },
  "permissions": [],
  "capabilities": [
    "audio.mix.v0.1"
  ]
}
