{
  "schema": "skenion.node.definition",
  "schemaVersion": "0.1.0",
  "id": "object.core.render.clear-color",
  "version": "0.1.0",
  "displayName": "Clear Color",
  "category": "Render",
  "ports": [
    {
      "id": "out",
      "direction": "output",
      "type": "value.core.tensor",
      "rate": "render",
      "description": "Frame produced by clearing the preview target."
    }
  ],
  "execution": {
    "model": "gpu_pass",
    "clock": "frame"
  },
  "state": {
    "persistent": false
  },
  "permissions": [],
  "capabilities": [
    "value.core.tensor.v0.1"
  ]
}
