{
  "schema": "skenion.node.definition",
  "schemaVersion": "0.1.0",
  "id": "render.clear-color",
  "version": "0.1.0",
  "displayName": "Clear Color",
  "category": "Render",
  "ports": [
    {
      "id": "out",
      "direction": "output",
      "label": "Out",
      "type": "gpu.texture2d"
    }
  ],
  "execution": {
    "model": "gpu_pass",
    "clock": "frame"
  },
  "state": {
    "persistent": false
  },
  "permissions": [],
  "capabilities": [
    "render.output.clear-color"
  ],
  "surface": {
    "palette": "direct"
  }
}
