{
  "schema": "skenion.node.definition",
  "schemaVersion": "0.1.0",
  "id": "audio.operator.sub",
  "version": "0.1.0",
  "displayName": "Audio Subtract",
  "category": "Audio",
  "ports": [
    {
      "id": "left",
      "direction": "input",
      "label": "Left",
      "type": "value.core.float32",
      "required": false,
      "rate": "audio"
    },
    {
      "id": "right",
      "direction": "input",
      "label": "Right",
      "type": "value.core.float32",
      "required": false,
      "rate": "audio"
    },
    {
      "id": "out",
      "direction": "output",
      "label": "Signal",
      "type": "value.core.float32",
      "rate": "audio"
    }
  ],
  "execution": {
    "model": "audio_block",
    "clock": "audio"
  },
  "state": {
    "persistent": false
  },
  "permissions": [],
  "capabilities": [
    "pd.audio.operator.v0.1"
  ]
}
