{
  "schema": "skenion.node.definition",
  "schemaVersion": "0.1.0",
  "id": "object.core.render.fullscreen-shader",
  "version": "0.1.0",
  "displayName": "Fullscreen Shader",
  "category": "Render",
  "ports": [
    {
      "id": "out",
      "direction": "output",
      "label": "Out",
      "type": "value.core.tensor"
    }
  ],
  "execution": {
    "model": "gpu_pass",
    "clock": "frame"
  },
  "state": {
    "persistent": false
  },
  "permissions": [],
  "capabilities": [
    "object.core.render.output.fullscreen-shader"
  ],
  "surface": {
    "palette": "direct"
  }
}
