{
  "schema": "skenion.node.definition",
  "schemaVersion": "0.1.0",
  "id": "core.preview",
  "version": "0.1.0",
  "displayName": "Preview",
  "category": "Output",
  "ports": [
    {
      "id": "texture",
      "direction": "input",
      "label": "Texture",
      "type": "gpu.texture2d",
      "required": true
    }
  ],
  "execution": {
    "model": "frame"
  },
  "state": {
    "persistent": false
  },
  "permissions": [],
  "capabilities": [],
  "surface": {
    "palette": "direct"
  }
}
