{
  "schema": "skenion.node.definition",
  "schemaVersion": "0.1.0",
  "id": "core.operator.div",
  "version": "0.1.0",
  "displayName": "Divide",
  "category": "Operators",
  "ports": [
    {
      "id": "in",
      "direction": "input",
      "label": "In",
      "type": "message.any",
      "required": false
    },
    {
      "id": "right",
      "direction": "input",
      "label": "Right",
      "type": "number.float",
      "required": false
    },
    {
      "id": "out",
      "direction": "output",
      "label": "Value",
      "type": "number.float"
    }
  ],
  "execution": {
    "model": "value"
  },
  "state": {
    "persistent": false
  },
  "permissions": [],
  "capabilities": [
    "pd.control.operator.v0.1"
  ]
}
